<?xml version="1.0" encoding="UTF-8" ?>
<Factura xmlns:xsi="http://www.w3.org/2001/XMLSchema-instance"
         xsi:noNamespaceSchemaLocation="http://172.19.127.101:9090/grupoAllanMario/facturas/xsd/Factura_XML.xsd">
  <CodigoFactura>Fact01</CodigoFactura>
  <Proveedor>Prov01</Proveedor>
  <Usuario>jrojas</Usuario>
  <FechaCompra>2014-06-25</FechaCompra>
  <LineasDeCompra>
  
    <LineaDeArticulo numeroLinea="1">
      <NombreDeArticulo>Mouse Infrarrojo</NombreDeArticulo>
      <ArticuloComprado codigo="MSInf" cantidad="2" precioUnitario="15"/>
    </LineaDeArticulo>
    
    <LineaDeArticulo numeroLinea="2">
      <NombreDeArticulo>Tarjeta Madre Plus</NombreDeArticulo>
      <ArticuloComprado codigo="TMPLUS" cantidad="5" precioUnitario="25"/>
    </LineaDeArticulo>
    
    <LineaDeArticulo numeroLinea="3">
      <NombreDeArticulo>Tarjeta Madre Máxima</NombreDeArticulo>
      <ArticuloComprado codigo="TMMAX" cantidad="1" precioUnitario="100"/>
    </LineaDeArticulo>
    
    <LineaDeArticulo numeroLinea="4">
      <NombreDeArticulo>Disco duro 1TB</NombreDeArticulo>
      <ArticuloComprado codigo="DD1TB" cantidad="5" precioUnitario="25.5"/>
    </LineaDeArticulo>
    
    <LineaDeArticulo numeroLinea="5">
      <NombreDeArticulo>Disco duro estado dólido</NombreDeArticulo>
      <ArticuloComprado codigo="DDSol" cantidad="3" precioUnitario="29.95"/>
    </LineaDeArticulo>
    
    <LineaDeArticulo numeroLinea="6">
      <NombreDeArticulo>Disco duro 300GB</NombreDeArticulo>
      <ArticuloComprado codigo="DD300GB" cantidad="3" precioUnitario="45"/>
    </LineaDeArticulo>
    
    <LineaDeArticulo numeroLinea="7">
      <NombreDeArticulo>Disco duro 700GB</NombreDeArticulo>
      <ArticuloComprado codigo="DD700GB" cantidad="3" precioUnitario="55.75"/>
    </LineaDeArticulo>
 
  </LineasDeCompra>
</Factura>
